{"author":"fixture-publisher","changedArtifacts":["manifest.json","submitted.patch","trajectory.jsonl"],"currentContentSetSha256":"6afad41a43d50a0e88053c4d9b8e2058a2a7bb19ed8265a821528ce8a9316532","reason":"Correct the submitted patch fixture.","revisionId":"revision:fixture-2","schemaType":"bundle-revision","schemaVersion":"evidence/v1","supersededContentSetSha256":"996ef5fc8565536aeeab2e2f4a0df4631ebb39b6a83ea8c88c552861c88ba2c5","supersededRevisionId":"revision:fixture-1","timestamp":"2026-01-02T00:00:00Z"}
